{
  "$schema": "http://json-schema.org/draft-07/schema#",
  "$id": "https://unpkg.com/@allodium/admin/view.schema.json",
  "title": "Allodium view definition",
  "description": "A single admin screen. The developer console writes these; the admin dashboard reads them. Everything derivable from the database — types, nullability, enum members, which table a foreign key points at — is read from the live catalog at render time and deliberately not repeated here.",
  "type": "object",
  "required": [
    "table"
  ],
  "additionalProperties": false,
  "properties": {
    "$schema": {
      "type": "string",
      "description": "Editor autocomplete only. Ignored at runtime."
    },
    "table": {
      "type": "string",
      "minLength": 1,
      "description": "SQL table this screen edits."
    },
    "title": {
      "type": "string",
      "description": "Heading. Defaults to the table name, title-cased."
    },
    "description": {
      "type": "string",
      "description": "Shown under the heading — what this screen is for, in the operator's language."
    },
    "primaryKey": {
      "type": "string",
      "description": "Column that identifies a row. Defaults to the table's primary key, which is almost always right."
    },
    "display": {
      "type": "string",
      "description": "How a row of THIS table is labelled when something else references it. A column name, or a template: \"{first_name} {last_name}\". Defining it here means the table describes itself once, for every screen that points at it.",
      "examples": [
        "name",
        "title",
        "{first_name} {last_name}"
      ]
    },
    "fields": {
      "type": "array",
      "description": "Fields, in the order they should appear. Omit to expose every visible column.",
      "items": {
        "$ref": "#/definitions/field"
      }
    },
    "list": {
      "$ref": "#/definitions/list"
    },
    "related": {
      "type": "array",
      "items": {
        "$ref": "#/definitions/relatedList"
      },
      "description": "Panels of related rows shown on the record screen."
    },
    "links": {
      "type": "array",
      "items": {
        "$ref": "#/definitions/link"
      },
      "description": "Links out of the admin derived from the row — \"View on site\", \"Preview\" — shown on list rows and the record screen."
    }
  },
  "definitions": {
    "link": {
      "type": "object",
      "required": [
        "label",
        "href"
      ],
      "additionalProperties": false,
      "description": "One link out of the admin. A URL template over the row's fields and an optional condition; never code.",
      "properties": {
        "label": {
          "type": "string",
          "minLength": 1,
          "description": "The link's text."
        },
        "href": {
          "type": "string",
          "pattern": "^(/(?!/)|[Hh][Tt][Tt][Pp][Ss]?://)",
          "description": "A template over the row's fields, e.g. \"/blog/{slug}\". Values are URL-encoded as substituted. Must be a path starting with \"/\" or an absolute http(s) URL. A row whose placeholder is empty renders no link.",
          "examples": [
            "/blog/{slug}",
            "/preview/posts/{id}",
            "https://example.com/work/{slug}"
          ]
        },
        "when": {
          "$ref": "#/definitions/filter",
          "description": "Show only for rows matching every predicate — published ones, say — so a draft is not offered a public address that 404s."
        },
        "target": {
          "enum": [
            "_blank",
            "_self"
          ],
          "description": "Open in a new tab (_blank) or the same one. Defaults to the same tab."
        },
        "in": {
          "type": "array",
          "description": "Where the link appears. Defaults to both.",
          "items": {
            "enum": [
              "list",
              "form"
            ]
          },
          "uniqueItems": true
        }
      }
    },
    "field": {
      "description": "A column, a foreign key, or a many-to-many.",
      "oneOf": [
        {
          "$ref": "#/definitions/columnField"
        },
        {
          "$ref": "#/definitions/relationField"
        },
        {
          "$ref": "#/definitions/m2mField"
        }
      ]
    },
    "columnField": {
      "type": "object",
      "title": "column",
      "description": "A plain column on this view's own table.",
      "required": [
        "column"
      ],
      "additionalProperties": false,
      "properties": {
        "kind": {
          "const": "column"
        },
        "column": {
          "type": "string",
          "minLength": 1,
          "description": "Column name on this view's table."
        },
        "widget": {
          "description": "Input to render. Defaults from the SQL type: enum → select, boolean → checkbox, timestamptz → datetime, jsonb → json, text[] → tags, numeric/int → number, everything else → text.",
          "enum": [
            "text",
            "textarea",
            "markdown",
            "number",
            "checkbox",
            "select",
            "radio",
            "date",
            "datetime",
            "json",
            "tags"
          ]
        },
        "options": {
          "type": "array",
          "description": "For select/radio on a NON-enum column. Enum columns get their members from the database automatically — listing them here would be a second source of truth.",
          "items": {
            "type": "object",
            "required": [
              "value"
            ],
            "additionalProperties": false,
            "properties": {
              "value": {
                "type": "string"
              },
              "label": {
                "type": "string"
              }
            }
          }
        },
        "placeholder": {
          "type": "string"
        },
        "label": {
          "$ref": "#/definitions/label"
        },
        "help": {
          "$ref": "#/definitions/help"
        },
        "readOnly": {
          "$ref": "#/definitions/readOnly"
        },
        "required": {
          "$ref": "#/definitions/required"
        },
        "in": {
          "$ref": "#/definitions/in"
        },
        "sortable": {
          "type": "boolean",
          "description": "Whether the list may be sorted by this field. Defaults to true; only ever set false."
        },
        "filterable": {
          "type": "boolean",
          "description": "Whether the operator may filter on this field. Defaults to true; a filter on a false field is refused, not ignored."
        }
      }
    },
    "relationField": {
      "type": "object",
      "title": "relation (foreign key)",
      "description": "Which row of another table this one is attached to. The console fills `relation` in from the catalog's FK graph; the genuinely human decision is `display`.",
      "required": [
        "kind",
        "column",
        "relation"
      ],
      "additionalProperties": false,
      "properties": {
        "kind": {
          "const": "relation"
        },
        "column": {
          "type": "string",
          "minLength": 1,
          "description": "The foreign-key column on this view's table."
        },
        "relation": {
          "type": "object",
          "required": [
            "table"
          ],
          "additionalProperties": false,
          "properties": {
            "table": {
              "type": "string",
              "minLength": 1,
              "description": "Referenced table."
            },
            "value": {
              "type": "string",
              "description": "Referenced column — the value actually stored. Defaults to that table's primary key."
            },
            "display": {
              "type": "string",
              "description": "Column or template shown to the operator, since the database stores an opaque id. Falls back to the target table's own `display`.",
              "examples": [
                "name",
                "{first_name} {last_name}"
              ]
            },
            "filter": {
              "$ref": "#/definitions/filter",
              "description": "Restrict selectable rows, e.g. { \"archived\": false }."
            }
          }
        },
        "widget": {
          "description": "select for many options, radio for a handful, autocomplete for very many.",
          "enum": [
            "select",
            "radio",
            "autocomplete"
          ]
        },
        "label": {
          "$ref": "#/definitions/label"
        },
        "help": {
          "$ref": "#/definitions/help"
        },
        "readOnly": {
          "$ref": "#/definitions/readOnly"
        },
        "required": {
          "$ref": "#/definitions/required"
        },
        "in": {
          "$ref": "#/definitions/in"
        },
        "sortable": {
          "type": "boolean",
          "description": "Whether the list may be sorted by this field. Defaults to true; only ever set false."
        },
        "filterable": {
          "type": "boolean",
          "description": "Whether the operator may filter on this field. Defaults to true; a filter on a false field is refused, not ignored."
        }
      }
    },
    "m2mField": {
      "type": "object",
      "title": "many-to-many",
      "description": "A many-to-many across a join table. A join table is a composite primary key whose columns are all foreign keys — NOT merely 'a table with two foreign keys'. Any other column on it is payload (granted_at, sort_order) and is not editable through this field.",
      "required": [
        "kind",
        "through",
        "near",
        "far",
        "farTable"
      ],
      "additionalProperties": false,
      "properties": {
        "kind": {
          "const": "m2m"
        },
        "name": {
          "type": "string",
          "description": "Field name in the form's value object; it has no column of its own. Defaults to farTable."
        },
        "through": {
          "type": "string",
          "minLength": 1,
          "description": "The join table."
        },
        "near": {
          "type": "string",
          "minLength": 1,
          "description": "Join-table column pointing back at this view's table."
        },
        "far": {
          "type": "string",
          "minLength": 1,
          "description": "Join-table column pointing at the other side."
        },
        "farTable": {
          "type": "string",
          "minLength": 1,
          "description": "The table on the other side."
        },
        "farValue": {
          "type": "string",
          "description": "Column `far` references. Defaults to farTable's primary key."
        },
        "display": {
          "type": "string",
          "description": "Column or template shown per option. Falls back to the far table's own `display`."
        },
        "widget": {
          "enum": [
            "checkboxes",
            "multiselect",
            "tags"
          ]
        },
        "label": {
          "$ref": "#/definitions/label"
        },
        "help": {
          "$ref": "#/definitions/help"
        },
        "readOnly": {
          "$ref": "#/definitions/readOnly"
        },
        "required": {
          "$ref": "#/definitions/required"
        },
        "in": {
          "$ref": "#/definitions/in"
        },
        "sortable": {
          "type": "boolean",
          "description": "Whether the list may be sorted by this field. Defaults to true; only ever set false."
        },
        "filterable": {
          "type": "boolean",
          "description": "Whether the operator may filter on this field. Defaults to true; a filter on a false field is refused, not ignored."
        }
      }
    },
    "list": {
      "type": "object",
      "description": "List-screen behavior.",
      "additionalProperties": false,
      "properties": {
        "columns": {
          "type": "array",
          "description": "Columns shown in the table, in order. Defaults to the first few fields.",
          "items": {
            "type": "string"
          }
        },
        "pageSize": {
          "type": "integer",
          "minimum": 1,
          "description": "Rows per page. Defaults to 25."
        },
        "sort": {
          "type": "object",
          "required": [
            "column"
          ],
          "additionalProperties": false,
          "properties": {
            "column": {
              "type": "string"
            },
            "direction": {
              "enum": [
                "asc",
                "desc"
              ]
            }
          }
        },
        "searchColumns": {
          "type": "array",
          "description": "Columns a search box should match against (ILIKE).",
          "items": {
            "type": "string"
          }
        },
        "filter": {
          "$ref": "#/definitions/filter",
          "description": "Rows this screen may show at all. A baseline the operator cannot clear — not a security boundary."
        }
      }
    },
    "label": {
      "type": "string",
      "description": "Human label. Defaults to the column name, title-cased."
    },
    "help": {
      "type": "string",
      "description": "Help text under the input. Omit to inherit the column's Postgres COMMENT, so a description written once in the schema reaches every screen without being restated."
    },
    "readOnly": {
      "type": "boolean",
      "description": "Visible but not editable."
    },
    "required": {
      "type": "boolean",
      "description": "Override the schema's nullability. Defaults to NOT NULL ⇒ required."
    },
    "in": {
      "type": "array",
      "description": "Where this field appears. Defaults to both.",
      "items": {
        "enum": [
          "list",
          "form"
        ]
      },
      "uniqueItems": true
    },
    "predicate": {
      "type": "object",
      "required": [
        "column"
      ],
      "additionalProperties": false,
      "properties": {
        "column": {
          "type": "string",
          "description": "A field key on the view (or a column, on a relation target)."
        },
        "op": {
          "enum": [
            "eq",
            "ne",
            "lt",
            "lte",
            "gt",
            "gte",
            "contains",
            "startsWith",
            "endsWith",
            "in",
            "isNull",
            "notNull"
          ],
          "description": "Defaults to in for an array value, isNull for null, eq otherwise."
        },
        "value": {
          "oneOf": [
            {
              "type": [
                "string",
                "number",
                "boolean",
                "null"
              ]
            },
            {
              "type": "array",
              "items": {
                "type": [
                  "string",
                  "number",
                  "boolean",
                  "null"
                ]
              }
            }
          ]
        }
      }
    },
    "filter": {
      "description": "Predicates, ANDed. Either the explicit array or the equality shorthand { column: value }.",
      "oneOf": [
        {
          "type": "array",
          "items": {
            "$ref": "#/definitions/predicate"
          }
        },
        {
          "type": "object",
          "additionalProperties": {
            "oneOf": [
              {
                "type": [
                  "string",
                  "number",
                  "boolean",
                  "null"
                ]
              },
              {
                "type": "array",
                "items": {
                  "type": [
                    "string",
                    "number",
                    "boolean",
                    "null"
                  ]
                }
              }
            ]
          }
        }
      ]
    },
    "relatedList": {
      "type": "object",
      "required": [
        "table",
        "foreignKey"
      ],
      "additionalProperties": false,
      "description": "Rows of another table that belong to this one — the inbound direction of a foreign key.",
      "properties": {
        "table": {
          "type": "string",
          "description": "The table whose rows belong to this one."
        },
        "foreignKey": {
          "type": "string",
          "description": "The foreign-key column ON THAT TABLE pointing back here."
        },
        "title": {
          "type": "string",
          "description": "Heading. Defaults to the table name, title-cased."
        },
        "view": {
          "type": "string",
          "description": "View used to render the panel. Defaults to the table name."
        },
        "references": {
          "type": "string",
          "description": "Column of THIS table the foreign key points at. Defaults to the primary key."
        },
        "pageSize": {
          "type": "integer",
          "minimum": 1,
          "description": "Rows per page in the panel. Defaults to 5."
        }
      }
    }
  }
}
